{
  "schema_name": "telemetry-envelope",
  "schema_version": "0.1.0",
  "run_id": "run_0195395c-7c9e-7f56-9b70-2c4d6e8f0a12",
  "stream_id": "provider-stream-1",
  "sequence": 0,
  "timestamp": "2026-08-09T12:02:30Z",
  "producer_namespace": "example.provider",
  "event_type": "provider-owned-event",
  "payload_schema": "urn:ea-research-lab:schema:example-telemetry-payload:0.1.0",
  "payload": {
    "provider_owned_observation": {
      "nested": [1, true, null]
    }
  }
}
